{
  "$schema": "./schemas/state-drivers.schema.json",
  "format": "cognium-a11y-state-drivers",
  "format_version": "1.0.0",
  "generated": "2026-10-19",
  "policy": {
    "scope": "Every case declaring a non-default ui_state or an interaction / state-exploration method answers here. A case in the default state with no interaction method needs no declaration, and its absence is not a gap.",
    "evidence": "An `interaction` driver carries a post-condition that is false before its steps run and true after. A runner reports state_reached from that observable rather than assuming, so \"state never reached\" and \"state reached, defect missed\" stay distinct.",
    "fixtures": "No fixture was changed to make a driver shorter or a defect easier to detect. Selectors address the pages as they already are."
  },
  "drivers": [
    {
      "case_id": "aaa-concurrent_input",
      "path": "aaa/concurrent_input.html",
      "declared_state": "default",
      "reached": "interaction",
      "steps": [
        {
          "action": "focus",
          "selector": "#inc"
        },
        {
          "action": "press",
          "key": "Enter",
          "selector": "#inc"
        }
      ],
      "post_condition": {
        "kind": "text-matches",
        "selector": "#n",
        "pattern": "2"
      }
    },
    {
      "case_id": "aaa-error_prevention_all",
      "path": "aaa/error_prevention_all.html",
      "declared_state": "submitted",
      "reached": "interaction",
      "steps": [
        {
          "action": "fill",
          "selector": "#to",
          "value": "ACME Ltd"
        },
        {
          "action": "fill",
          "selector": "#amt",
          "value": "2500"
        },
        {
          "action": "click",
          "selector": "#send"
        }
      ],
      "post_condition": {
        "kind": "text-matches",
        "selector": "#state",
        "pattern": "\\S"
      }
    },
    {
      "case_id": "aaa-focus_appearance",
      "path": "aaa/focus_appearance.html",
      "declared_state": "default",
      "reached": "interaction",
      "steps": [
        {
          "action": "focus",
          "selector": "main button"
        }
      ],
      "post_condition": {
        "kind": "focus-within",
        "selector": "main button"
      }
    },
    {
      "case_id": "aaa-focus_not_obscured_enhanced",
      "path": "aaa/focus_not_obscured_enhanced.html",
      "declared_state": "default",
      "reached": "interaction",
      "steps": [
        {
          "action": "focus",
          "selector": "main button:last-of-type"
        }
      ],
      "post_condition": {
        "kind": "focus-within",
        "selector": "main button:last-of-type"
      }
    },
    {
      "case_id": "aaa-no_timing",
      "path": "aaa/no_timing.html",
      "declared_state": "timed-out",
      "reached": "interaction",
      "steps": [
        {
          "action": "wait",
          "timeout_ms": 31000,
          "note": "the page offers no control to expire it early"
        }
      ],
      "post_condition": {
        "kind": "text-matches",
        "selector": "#clock",
        "pattern": "expired"
      }
    },
    {
      "case_id": "aaa-re_authenticating",
      "path": "aaa/re_authenticating.html",
      "declared_state": "timed-out",
      "reached": "interaction",
      "steps": [
        {
          "action": "fill",
          "selector": "#a",
          "value": "Window seat"
        },
        {
          "action": "click",
          "selector": "#expire"
        }
      ],
      "post_condition": {
        "kind": "text-matches",
        "selector": "#state",
        "pattern": "Session expired"
      }
    },
    {
      "case_id": "aaa-safe_concurrent_input",
      "path": "aaa/safe_concurrent_input.html",
      "declared_state": "default",
      "reached": "interaction",
      "steps": [
        {
          "action": "focus",
          "selector": "#inc"
        },
        {
          "action": "press",
          "key": "Enter",
          "selector": "#inc"
        }
      ],
      "post_condition": {
        "kind": "text-matches",
        "selector": "#n",
        "pattern": "2"
      }
    },
    {
      "case_id": "aaa-safe_error_prevention_all",
      "path": "aaa/safe_error_prevention_all.html",
      "declared_state": "submitted",
      "reached": "interaction",
      "steps": [
        {
          "action": "fill",
          "selector": "#to",
          "value": "ACME Ltd"
        },
        {
          "action": "fill",
          "selector": "#amt",
          "value": "2500"
        },
        {
          "action": "click",
          "selector": "#send"
        }
      ],
      "post_condition": {
        "kind": "present",
        "selector": "#review:not([hidden])"
      }
    },
    {
      "case_id": "aaa-safe_focus_appearance",
      "path": "aaa/safe_focus_appearance.html",
      "declared_state": "default",
      "reached": "interaction",
      "steps": [
        {
          "action": "focus",
          "selector": "main button"
        }
      ],
      "post_condition": {
        "kind": "focus-within",
        "selector": "main button"
      }
    },
    {
      "case_id": "aaa-safe_focus_not_obscured_enhanced",
      "path": "aaa/safe_focus_not_obscured_enhanced.html",
      "declared_state": "default",
      "reached": "interaction",
      "steps": [
        {
          "action": "focus",
          "selector": "main button:last-of-type"
        }
      ],
      "post_condition": {
        "kind": "focus-within",
        "selector": "main button:last-of-type"
      }
    },
    {
      "case_id": "aaa-safe_no_timing",
      "path": "aaa/safe_no_timing.html",
      "declared_state": "timed-out",
      "reached": "at-load",
      "reason": "The page contains no script, so it renders exactly one state: the one it declares. There is nothing to drive, and an engine that loaded it saw the state the case is about."
    },
    {
      "case_id": "aaa-safe_re_authenticating",
      "path": "aaa/safe_re_authenticating.html",
      "declared_state": "timed-out",
      "reached": "interaction",
      "steps": [
        {
          "action": "fill",
          "selector": "#a",
          "value": "Window seat"
        },
        {
          "action": "click",
          "selector": "#expire"
        }
      ],
      "post_condition": {
        "kind": "text-matches",
        "selector": "#state",
        "pattern": "Session expired"
      }
    },
    {
      "case_id": "color-chart_series_color_only",
      "path": "color-independent/chart_series_color_only.html",
      "declared_state": "invalid",
      "reached": "at-load",
      "reason": "The page contains no script, so it renders exactly one state: the one it declares. There is nothing to drive, and an engine that loaded it saw the state the case is about."
    },
    {
      "case_id": "color-disabled_state",
      "path": "color-independent/disabled_state.html",
      "declared_state": "invalid",
      "reached": "at-load",
      "reason": "The page contains no script, so it renders exactly one state: the one it declares. There is nothing to drive, and an engine that loaded it saw the state the case is about."
    },
    {
      "case_id": "color-error_color_only",
      "path": "color-independent/error_color_only.html",
      "declared_state": "invalid",
      "reached": "at-load",
      "reason": "The page contains no script, so it renders exactly one state: the one it declares. There is nothing to drive, and an engine that loaded it saw the state the case is about."
    },
    {
      "case_id": "color-link_color_only",
      "path": "color-independent/link_color_only.html",
      "declared_state": "invalid",
      "reached": "at-load",
      "reason": "The page contains no script, so it renders exactly one state: the one it declares. There is nothing to drive, and an engine that loaded it saw the state the case is about."
    },
    {
      "case_id": "color-placeholder_contrast",
      "path": "color-independent/placeholder_contrast.html",
      "declared_state": "invalid",
      "reached": "at-load",
      "reason": "The page contains no script, so it renders exactly one state: the one it declares. There is nothing to drive, and an engine that loaded it saw the state the case is about."
    },
    {
      "case_id": "color-required_color_only",
      "path": "color-independent/required_color_only.html",
      "declared_state": "invalid",
      "reached": "at-load",
      "reason": "The page contains no script, so it renders exactly one state: the one it declares. There is nothing to drive, and an engine that loaded it saw the state the case is about."
    },
    {
      "case_id": "color-selection_color_only",
      "path": "color-independent/selection_color_only.html",
      "declared_state": "invalid",
      "reached": "interaction",
      "steps": [
        {
          "action": "click",
          "selector": "main div button:nth-of-type(2)"
        }
      ],
      "post_condition": {
        "kind": "present",
        "selector": "main div button:nth-of-type(2).sel"
      }
    },
    {
      "case_id": "color-status_color_only",
      "path": "color-independent/status_color_only.html",
      "declared_state": "invalid",
      "reached": "at-load",
      "reason": "The page contains no script, so it renders exactly one state: the one it declares. There is nothing to drive, and an engine that loaded it saw the state the case is about."
    },
    {
      "case_id": "journey-booking-broken",
      "path": "journeys/booking/broken/index.html",
      "declared_state": "default",
      "reached": "declared-steps",
      "reason": "The walk is already enumerated in this case's own steps (5 pages); each page loads in its own right, so there is no single-page state to drive."
    },
    {
      "case_id": "journey-booking-correct",
      "path": "journeys/booking/correct/index.html",
      "declared_state": "default",